{
  "schema_version": "1.0.0",
  "generated_at": "2025-12-30T00:00:00Z",
  "render_mode": "hybrid",
  "output": {
    "format": "mp4",
    "width": 1080,
    "height": 1920,
    "fps": 30,
    "audio_sample_rate": 48000,
    "filename": "output.mp4"
  },
  "providers": {
    "tts": {
      "provider": "elevenlabs",
      "voice_id": "your_voice",
      "language": "ja"
    },
    "lipsync": {
      "provider": "some-lipsync",
      "target_face_image_asset_id": "face01",
      "strength": 0.8
    }
  },
  "assets": [
    {
      "id": "orig_video",
      "type": "video",
      "uri": "gcs://bucket/original.mp4",
      "sha256": "0000000000000000000000000000000000000000000000000000000000000000",
      "meta": {
        "note": "placeholder"
      }
    },
    {
      "id": "face01",
      "type": "image",
      "uri": "gcs://bucket/face.png",
      "sha256": "1111111111111111111111111111111111111111111111111111111111111111",
      "meta": {}
    }
  ],
  "segments": [
    {
      "id": "s01",
      "duration_ms": 8000,
      "video": {
        "mode": "reuse_original",
        "source": {
          "asset_id": "orig_video",
          "in_ms": 0,
          "out_ms": 8000
        }
      },
      "audio": {
        "mode": "tts",
        "speaker_profile_id": "host",
        "script": "今日は『AIシステム開発の未来』について、短く3つにまとめて話します。",
        "lipsync": {
          "enabled": true,
          "target_face_image_asset_id": "face01"
        }
      },
      "overlays": {
        "captions": {
          "enabled": true,
          "style": "default"
        }
      }
    },
    {
      "id": "s02",
      "duration_ms": 52000,
      "video": {
        "mode": "generate",
        "source": {
          "prompt": "未来的なオフィスでAIが動くイメージ。アニメ風。"
        }
      },
      "audio": {
        "mode": "tts",
        "speaker_profile_id": "host",
        "script": "ポイントは3つです。1つ目は自動化。2つ目はAIエージェント。3つ目は検証と安全性です。",
        "lipsync": {
          "enabled": true,
          "target_face_image_asset_id": "face01"
        }
      },
      "overlays": {
        "telops": [
          {
            "text": "ポイント① 自動化",
            "start_ms": 1000,
            "end_ms": 6000,
            "style_hint": "bold"
          }
        ]
      }
    }
  ]
}
